;text;klasifikasi
221;habis update tiap mau pesan keluar ke menu utama lagi ga kepake aplikasinya;Negatif
222;sebagai pecinta kopi ya ngerasa kebantu banget sama aplikasi ini pickupnya gampang semoga makin banyak promonya yaaa;Positif
223;hapus aja aplikasi lambat dan tidak niat memberikan promo promonya selalu tidak tersedia di outlet;Negatif
224;aplikasi nya sangat memudahkan kita untuk memesan kopi sistemnya lebih mudah di gunakan dan pelayanan anternya cepet;Positif
225;beneran tampilan aplikasinya bagus banget sederhana mempermudah kita mau pencet apa terus tinggal pickup dan ambil jadi tidak perlu ngantre;Positif
226;promo doang banyak orderan dibatalin terus iklan aplikasi doang;Negatif
227;aplikasinya responsif dan promonya banyak terimakasih janji jiwa ;Positif
228;bisa jadi andalan klo lagi mager ngantri karna pesan di aplikasi bisa lsg ambil kopi aja ke tokonya tanpa perlu ngantri;Positif
229;banyak promo menarik di aplikasi terimakasih jiwa plus;Positif
230;semoga promo janji pasti hematnya gak berakhir sebagai team kopi tiap hari dah cinta banget sama aplikasi ini ;Positif
231;pake aplikasi ini jadi ketagihan beli toast dan kopi lewat sini promonya banyak dan dapet points barusan order toast pakai jiwa points yang selama ini dikumpulin yeayyyy;Positif
232;top;Positif
233;tampilan aplikasinya simpel jadi gampang dipake tidak ribet banyak juga promo yang bisa dipake;Positif
234;buat yang suka minum kopi ini untung banget sih beli kopi dapet promo udah gitu pointnya bisa dikumpulin juga untungnya banyak;Positif
235;sudah sampe depan outlet malah di cancel ;Negatif
236;warga kosan ayo merapat ini selain banyak promo bisa ngumpulin poin lg jadi super hemat ;Positif
237;mempermudah kalo order buat di pickup sih apalagi kl mepet waktunya jadi pas sampe tidak perlu antri dan nunggu lama lagi gitu;Positif
238;order jadi lebih gampang dan promonya banyak banget sih jd untung untung untung;Positif
239;kenapa alamat outlet daerah banjarmasin tidak ada ;Negatif
240;gak sabar buat pake vouchernya sih mau sendiri mau ramean ttp semua worhtit bangett;Positif
241;terharu sm janji jiwa krn selalu berusaha kasih yg terbaik contohnya kaya banyak promo dan sistem poin yg skrg dipake di jiwa;Positif
242;baru aja pesan caramel latte sm jiwa toastnya td sore tentu krn pake promo makanya aku bisa boros huahahaha;Positif
243;tidak perlu galau lagi mikirin boros boros lg krn pake promo jiwa jd murah habis;Positif
244;super untung jajan jjan lewa jiwa deh ;Positif
245;selain promonya banyak disini juga ada jiwa points yg ngebantu buat bayar next payment gt gais;Positif
246;di aplikasi promo tiap mau pesan stok habis ;Negatif
247;gas download sih daripada kalian ketinggalan dan gadapet promonya;Positif
248;padahal download belom lama tp poin gw udh banyak banget wwwkkwk hebat banget si janjiw ini menarik pelanggan sperti gw;Positif
249;bakal rajin rajin numpukin jiwa points sih biar bs byr pake jerih payah w;Positif
250;order di cancel tapi saldo ga kembali;Negatif
251;percuma kasih promo tp setiap pesan tidak tersedia;Negatif
252;bisa beli tiap hari ini sih kalo promonya jiwa ga abis abis;Positif
253;tidak perlu lagi takut miskin di akhir bulan krn di jiwa banyak banget promo yang ga bikin katong menipis;Positif
254;belom nyampe sehari download gw udh beli janjiw x tolong ya jiwa kalo kasih promo jgn lebay banget kan gw jd tergiur ;Positif
255;sudah beberapa kali saya order via aplikasi tiba ini alamat saya yg pontianak bisa berubah jadi batam gimana sih ya jelas aku order seperti biasa eh begitu sadar rupanya jadi batam sejak kapan saya ubah jadi batam orang order via shopeefood saja bisa kedata alamat kita mengecewakan rencana ngopi malah emosi uang tertelan auto unistall orderan tidak bisa dicancel atau pengembalian dana atau ganti outlet ;Negatif
256;suka ada voucher voucher diskon gitu jadi tambah murah lagi deh mantap semoga makin banyak promonya;Positif
257;suka bangett samaa aplikasi ini deh pas awal bikin tuh aku lsg dapet voucher kebetulan jg diriku team harus ngopi biar senang jd sekalian ngumpulin point;Positif
258;aplikasinya gak berat di handphone tampilannya juga simple mau pick up order juga bisa jadi satset banget tinggal ambil ke store aja tanpa ngantri;Positif
259;uinya simpel banget pengguna baru pasti kaga pusing sama tampilannya voucher promonya banyak juga ;Positif
260;promo ada tapi tidak bisa dipake tulisan nya auto terpasang tapi ga masuk promonya semoga kedepannya ada tombol gunakan sekarang di promonya;Negatif
261;barusan order pake voucher krna pengguna baru tp pas dicek voucher promo lainnya jg banyak banget;Positif
262;promo sih tapi kalo mau pesan kopi susu abis mulu di aps ;Netral
263;bagus si kampanye peduli bumi mengurangi kantong plastik cuma kalian galiat cup yg dipake itu bahan dasarnya apa saya yg order via online merasa tidak nyaman yg tidak ada kantong plastik dan sedotan;Netral
264;mau kasih saran buat apa pickup pake aplikasi kalo ujung ujungnya harus konfirmasi dulu baru dibuatin kopi kenangan udah jadi tinggal dikasih es sama mereka jadi cepet tidak berguna aplikasi kalo ngantri ngantri juga;Netral
265;app tidak berguna niat jualan gk setiap pesan dibatalkan beda banget sama toko sebelah banyak promo dan poin;Negatif
266;niat jualan ga sih semua yg promo tidak bisa diorder ;Negatif
267;error app meminta pesan ulang karena error pas dicek saldo memang blum berkurang tp ternyata pas dipesan ulang yang pertama juga terproses mohon diperbaiki ;Negatif
268;baru download lgsg dapet promo mantap sekaliiii;Positif
269;pas awal download karna emg kepo kata temen gua promonya banyak pas udh pake emang banyak banget dong udah gitu tampilan aplikasinya sederhana tidak bikin pusing moo rajin kumpulin point ah;Positif
270;pesan langsung lewat aplikasi promonya banyak banget dan juga cepat banget si cepat banget nyiapin dan sampenya ga ada menit pesan udah sampe temen temen yang tadinya uninstall aplikasi ini dicoba download lagi aja mereka udah lebih baik banget dari sebelumnya mungkin banyak upgrade ;Positif
271;aneh banget gabisa deteksi alamat jelas saya di palembang malah alamatnya di jkt terus sayangnya juga gabisa dipake buat dine in ya cuma buat take away dan delivery ;Negatif
272;sorry klo saya harus uninstall app tersebut karna aplikasi tersebut tidak bisa order selalu batal karna di tidak di respon oleh restoran untuk apa kalian membayar iklan tapi kinerja app tidak di jalankan semoga kedepannya bisa lebih baik lagi;Negatif
273;pake aplikasi ini jd enak banget karna ada banyak banget voucher yang bisa kita pake setiap hari;Positif
274;mau klik delivery tidak bisa bisa udh gt lokasi yg deket rmh saya tidak ada padhal biasa beli di sana;Positif
275;jiwa points nya bisa dituker buat beli produk janjiw juga tauu jd untung banget order lewat app jiwa nya;Positif
276;sangat buruk outlet janji jiwa di banda aceh setiap ada promo di jiwa selalu tidak di buka outlet melalui jiwa nya;Negatif
277;tidak semua outlet ngaktifin apps tidak membantu apps meskipun harga murah;Negatif
278;suka banget ada aplikasi jiwa ini tiap hari selalu ada promo dimana harga nya jauh lebih murah daripada beli offline meskipun deket banget dari kantor tapi kalo mau beli via online dulu biar dapet harga promo nya ;Positif
279;beli toast sama minum sepaket murah bangettt grgr pesan lewat jiwa auto pake voucherr;Positif
280;kode otp ga masuk masuk;Negatif
281;cukup ok tp pas beli pakai promo kayak ada hal beda dan tolong di tambah paymentnya jangan ewallet saja misal virtual account bank gitu thx u;Netral
282;gak bisa bayar pake cash padahal pick up;Negatif
283;tambah lagi metode pembayarannya tolong resep kopi arennya distandarisasi lagi karna terlalu encer ngga spt mantan sy;Negatif
284;mesen kali yg pertama berhasil ga ada kendala yg kedua stuck di tahap menunggu outlet menerima pihak outlet gabisa konfirmasi pesanan karena eror di sistem gak ada opsi cancel padahal udh di kasih feedback dari user lain sejak maret;Negatif
285;payah lg ada promo kok diaplikasi tutup store lippo plaza jember outlet buka padahal;Negatif
286;tampilannya simpel banget tidak bikin pusingg ditambah lg ada banyak promo juga jadi beli toast sama minum murah bangettt;Positif
287;kalo emang ada promo diniatin dong masa udah order dibatalin hehe;Negatif
288;apasih tidak niat memberi promo ya tidak perlu sok sok an aku ngisi kode pin kenapa tidak bisa terus;Negatif
289;saya pernah order di cabang mawar merah tapi tibatiba dibatalkan oleh karyawannya dg alasan karena ramai order tapi pas sy datang tidak ada siapapun padahal sy sudah nunggu lama itu jadi terlihat banget alasan aslinya karena karyawan itu pemalas melayani pelanggan;Negatif
290;aplikasi tolol mesen apa dikasihnya apa;Negatif
291;bermasalah terus kapan bener nya kak;Negatif
292;tidak usah buat promo kalau gabisa di beli promo nya;Negatif
293;tolong dong min diupdate lagi masa di samarinda cuma outlet aja yang masuk di aplikasi ini itupun outlet nya jauh;Negatif
294;balikin saldo gopay ku setelah pesananan ku dibatalin;Negatif
295;aplikasi belom layak pakai udah di luncurin jelek lambat sering error kecewa banget;Negatif
296;promo sering habis jadi outletnya tidak tersedia gitu app lambat;Negatif
297;sudah dibayar malah pesanan di batalkan dan dana tidak kembali;Negatif
298;kacau;Negatif
299;keren banget enak;Positif
300;download aplikasi waktu mau menikmati promo malah tidak bisa buat masukin alamat loadingnya pun lama;Negatif
301;benerin dulu aplikasinya;Negatif
302;aplikasinya lama loadingnya;Negatif
303;aplikasi berat dan suka eror tiap kali masukan menunotif pesanan tidak dapat di proses menu pembayaran tidak ada qris;Negatif
304;promo cuma penipuan doang gak berguna;Negatif
305;aplikasi sampah;Negatif
306;lama dalam mengurus pesanan;Negatif
307;mau order harus login mau daftar susah setengah mati;Negatif
308;ga semua outlet ada di aplikasi jelek;Negatif
309;aplikasi lambat;Negatif
310;pas baru regis akun lgsg dpt voucher diskon untung bangett buat beli jajannn < ;Positif
311;baru aja gw pake ni voucher semoga makin banyak promo lagi ya jiwa biar gw betah beli di sini wkwkwk;Positif
312;appnya bagus dan banyak dapet info info promo dari sini so goood;Positif
313;aplikasi ribet order di lippo puri masuk ke puri mansion apartment susah lupa milih outlet;Negatif
314;promo diaplikasi nya masih ada tapi stock tidak tersedia sedangkan cust beli manual stock ada;Negatif
315;pertama tama tampilan designnya perlu diapresiasi soalnya sederhana tapi tetap informatif ditambah lagi karena udah sejalan sama rebrand mereka yg baru jadinya jauh lebih segar aja liatnya;Positif
316;selalu dapet diskon;Positif
317;eh mantap banget deh tinggal order kupi di app jiwa terus pick up aja jadi mudah banget tidak perlu pake ngantri;Positif
318;jelek banget pelayanan kalau ga nerima orderan promo tidak perlu dimunculin di app nya buang buang waktu pick up ;Negatif
319;aplikasi gak berlaku di riau lawak si wkwkwkwk;Negatif
320;karena banyak promo jd sering banget beli janjiw di jiwa buat minum bareng anakanak kantor;Positif
321;merasa di bohongi point' saya sudah puluhan ribu tetapi tidak bisa digunakan padahal sudah berbulan bulan kata admin ig alesan nya aplikasi belum mendukung aneh banget nyiptain point' tp aplikasi ga mendukung kalah sama fore dan kopi kenangan;Negatif
322;d aplikasi pesanan sudah selesai pas di ambil belum di bikin mulu bukan sekali kali ini ;Negatif
323;pas beli diskon outlet selalu nolak sangat tidak sopan sekali;Negatif
324;download ini tuh awalnya emg cuma karna promo ajaa tp skrng jd pake setiap hari karna emg ngebantu banget buat order kopi tinggal pick up aja dehhh;Positif
325;jadi tidak akan ketinggalan kalo ada promo dari janjiw semenjak pake aplikasi inii soalnya di tampilan utama app nya aja langsung muncul banyak info diskon dan menu baru keren banget lo janjiw ;Positif
326;aplikasinya bagus nyaman ga lambat teman bisa pakai kode referal sofiei untuk diskon^^;Positif
327;tau aplikasi ini dari temen gw fix gw bakal ngumpulin banyak poin sih soalnya gw emg suka beli janjiw dari duluu ;Positif
328;pesan di app jiwa ini jadi lebih gampang soalnya semua menu lengkap banget dan bs pilih berbagai outlet terdekat;Positif
329;jadi lebih mudah untuk pesan via online;Positif
330;bisa bagi kode referral jg ke temen loh kalo mau dpt voucher asal mrk masukin kode referral aja pas baruu download;Positif
331;promo lewat aplikasi ok tapi order yang salah tidak bisa di batalkan misal mengganti lokasi pick up mungkin bisa di tambahkan fitur pembatalanedit di detik pertama jiwa care juga harus lebih responsif ;Netral
332;jadi jiwa bisa ngumpulin jiwa points biar bisa dituker sama produk janjiw gituu untung bangett pake app ini;Positif
333;ih enak banget di jiwa aku biasanya pake ini buat pick up order jd tidak perlu ngantri lagi asik banget dah jadi cepat;Positif
334;buruk sekali aplikasinya lambat dan tidak bisa terhubung dengan gopay alhasil kali gagal transaksi dan milih beli yg lain aja mohon dibenahi ;Negatif
335;mohon maaf aku pecinta janji jiwa kenapa kemasan di rubah yang baru ga bagus ga banget deh lebih bagus design yang lama kemasannya jadi ga menarik bikin ga mood deh bisa balikan ke design yang lama ga sedotannya juga ga bagus pokoknya aku suka yang lama lebih berkarakter dan berkelas terima kasih ;Negatif
336;tolong untuk order masuk dikasih bunyi notifikasi biar outlet langsung tau bahwa ada order masuk sy berapa kali gagal karna outlet tidak tau ada order jadi order tidak diterima yg akhirnya dibatalkan secara otomatis oleh app;Negatif
337;oke dan mudah;Positif
338;kesan pertama saya sangat buruk terhadap apps ini saya coba delivery via apps bnr lama sekali prosesnya dri saya pesan sampai ketangan saya memakan waktu jam kendala ada di driver saya kli ganti driver karena yg pertama tidak jalan status otw outlet tidak berubah selama mnit dan untuk yg kedua sama seperti itu cuman yg kedua ini setelah saya komplain baru ada pergerakan untuk kdpnnya lebih diperhatikan lagi lah kerjasama dengan jasa antar nya klo kek gini bnr ngecewain ;Negatif
339;mantap anjay mabar semagat developer yang harus bersabar dalam memperbaiki eror pada aplikasi ini;Positif
340;upgrade mulu tapi sistem tidak dibenahin mau mesen aja harus ngulang mulu dibatalin mulu sama sistem mesen jam siang baru gk eror jam an lu gila ya bikin aplikasi;Negatif
341;yg diskon stok kosong terus seluruh toko di palembang pdhal dr aplikasi lain ada ;Negatif
342;pesan gagal mulu bikin emosi;Negatif
343;di cancel;Negatif
344;aplikasi paling ngabisin semua ga sampe sebulan rasanya minta update terus ;Negatif
345;pelayanannya jelek aku sudah pesan nyampenya hampir jam;Negatif
346;diskon promo kemudahan bertransaksi nya juga oke yang jadi masalah app nya lambat berat lambat ;Netral
347;cepat tepat berdaya guna;Positif
348;mau pesan aja susah banget ya sampe batal terus;Negatif
349;uninstall aja app sampah ini di app semua item kosong atau outlet nya tutup apalagi yg promo selalu tidak tersedia giliran langsung beli outlet ternyata ada dan tersedia ;Negatif
350;masuk aplikasi lambat sekali lag ;Negatif
351;percuma flast sale gak bsa di order klo gak niat y gak usah dong ;Negatif
352;bintang ajadi daerah saya menunya tidak tersedia mulu;Negatif
353;oke;Positif
354;masa iya tiap hari kopi susu di janji jiwa dempo hm rasyad selalu kosong dari tgl juli smpe agustus tiap cek pasti gak tersedia niat ngak sih buat promo persevering tolong di follow up ;Negatif
355;di pilihan menu statusnya ada begitu masuk keranjang tidak tersedia;Negatif
356;untuk outlet yang terdekat dalam kota tidak tersedia di aplikasi padahal ada outlet malah yg ada cma di luar kota aneh banget ni aplikasi tidak mempermudah konsumen ;Negatif
357;abis pesan pake delivery pas pakai voucher tiba tiba stlh byr pake orenpay jd pickup akhirnya ngambil deh ke lokasi diperbaiki lagi aplikasinya;Negatif
358;nggak ada janji jiwa yang di manado;Negatif
359;aplikasi lambat boss mohon diperbaiki;Negatif
360;min tambahin pilihan minumannya biar sama seperti di outlet dong atau bikin mudah seperti pilihan yg ada terpajang di outlet munculin semua seperti aplikasi yg lama ;Netral
361;setelah update kok malah eror aplikasinya;Negatif
362;loading nya lama;Negatif
363;pelayanan sangat mengecewakan pesan di sistem tiba dibatalkan ;Negatif
364;ada voucher ongkir voucher diskon diskon tpi semuanya gabisa dipake voucher tidak dapat digunakan padahal udh memenuhi syarat pembelian aneh ;Negatif
365;mantap sangat bagus kasi promonya lagi dong;Positif
366;eror;Negatif
367;gak ada produk koq jualan di aplikasi payah;Negatif
368;uang saya gabalik balik;Negatif
369;aplikasi sering eror;Negatif
370;semoga ada tambahan pilihan metode pembayaran yang bayar tunai ditempat kadang di metode pembayaran digital lupa saldo terimakasih;Netral
371;update mulu perasaan cepet banget ini harus update lagi dan lagi;Negatif
372;aneh store buka tapi di aplikasi tutup yang buka di luar kota semua;Negatif
373;outlet pekanbaru gak ada;Negatif
374;bagus banget;Positif
375;aplikasi kocak update terus setiap minggu;Negatif
376;saya pesan x tapi di batal kan mksd nya apaa;Negatif
377;promo banyak tapi pas order malah dicancel outlet gak ada kejelasan juga ngapa tiba tiba dicancel;Negatif
378;app gajelas semua outletnya tutup;Negatif
379;kecewa masak iya mau aktifin nomer harus nunggu hari ;Negatif
380;aplikasi busuk;Negatif
381;aplikasi error terus sekali aja bisa abis itu dibatalkan terus ;Negatif
382;voucher promo gak bisa dipakai saat co kalo gak niat bikin promo gak usah promo ongkir kok lebih mahal dr aplikasi grab ya mending beli via grab lah trus aplikasi jj apa gunanya ;Negatif
383;oke dan banyak promo;Positif
384;cara pakai vouchernya gimana baru install aplikasi tapi tidak bisa pakai voucher promo kasih tau nanti saya rubah bintangnya;Netral
385;ongkirnya mahal;Negatif
386;gak ada kejelasan sudah order tapi gak ada yang pickup untuk order delivery pesanan tidak sampai ke alamat;Negatif
387;untuk promo dan voucher cukup oke penggunaan aplikasi cukup mudah walaupun agak lambat tetapi setelah kali order terasa sekali penurunan kualitas minuman yang dibeli lewat aplikasi daripada beli langsung ke outlet terasa sekali perbedaan rasanya jadi kecewa;Netral
388;pembayarannya kemaren bisa pake ovo ehh skrg cuman go pay padahal baru download kemaren dan belum pesan;Negatif
389;payah order pickup di batalin sma pihak outlet;Negatif
390;lagi event diskon pas udah bayar eh malah pesanan dibatalkan wkwkwk;Negatif
391;niatnya baik punya aplikasi tinggal pesan jadi ga harus menunggu antri lah malah tiba di batalkan gak tau yg batalkan dari aplikasinya atau outletnya yg tidak mau menerima aneh ;Negatif
392;serius masa tidak bisa login si;Negatif
393;aplikasi rusak outlet trisakti banjarmasin malah gak ada emg blm lengkap atau aplikasi ny yg rusak benerin dlu aplikasi ny tambahin dlu outlet nya trus mudahkan dalam pencarian outlet ny;Negatif
394;ga jelas aplikasi nya kebatal dua kali pertama kebatal terus saldo gopay ga dikembaliin kedua kebatal ga diproses tidak jelas aplikasinya;Negatif
395;sejauh ini sudah puluhan kali beli melalui apps tidak ada kendala dan proses cepat tinggal ambil dilokasi tapi tapiii setiap beli minuman dengan penawaran promo atau diskon rasa minumannya sering kali berubah ubah tidak konsisten dan beberapa kali bahkan tidak enak rasanya ;Negatif
396;ada promo tapi barang nya tidak tersedia trus aplikasi sampah ;Negatif
397;mimin makasih udahh kasih promo terus kalo pake aplikasi ;Positif
398;outlet janji jiwa palm spring tutup terus di aplikasi kayaknya karyawan sengaja matikan di aplikasi biar promo tidak bisa dipakai atau malas orderan banyak wkwkwk so tidak bisa mesan hmm mengecewakan sekali ;Negatif
399;sering bermasalah saat transaksi sering cancel;Negatif
400;voucher nya tidak bisa digunakan;Negatif
401;aplikasinya lambat mau nentuin aplikasi terdekat aja susah banget mana pas otomatis kedainya di denpasar lagi giak jauh amat bisa bangkrut gua;Negatif
402;baru juga selesai download aplikasi udh minta di update aja bikin penuh memori;Negatif
403;terus berkembang menjadi lebih baik ya;Netral
404;sering sering promo yaaa min jj;Positif
405;banyak promo tp aplikasinya sering banget harus diperbarui mana mau perbarui tidak bisa jadi harus di hapus terus instal ulang;Negatif
406;banyak banget diskonan nya keren banget ni aplikasi;Positif
407;aplikasi terbaik pemesanan kopi online lebih baik dari kopi yang lain banyak diskon dan promonya up to gunakan kode referral iymeue untuk dapat promonya ;Positif
408;pilihan menu tidak bisa diubah oleh karyawan di outlet terkait ada outlet yg buka tetapi pas pesan terdapat notifikasi outlet tutup sudah beberapa kali pesan tetapi tidak langsung di respon oleh outlet ada outlet yang lebih dekat tetapi tidak terdeteksi di aplikasi atau belum ada di aplikasi mohon management segara perbaiki terimakasih;Negatif
409;saya daftar mengalami kendala ketika memasukkan pin baru ada kotak tapi yang terisi hanya kotak ada peringatan refferal code not found saya coba download di hp lain tetap sama kotak pin yang bisa di isi hanya kotak jadi tolong diperbaiki ya biar saya update juga bintangnya saat ini saya uninstall dulu aplikasinya terima kasih kepada staf kopi janji jiwa soekarno tahunan jepara mas rizqi yg memberikan saya kesempatan menggunakan akunnya utk order kopi roti kentangnya ;Negatif
410;aneh banget pesan lewat aplikasi dekat outlet udah laoding lama tiba pesanan di batalkan padahal pas outlet sepi ga ada pengunjung mau ngulang lagi malas alhasil beli kopi yg lain ;Negatif
411;ribet banget harus ini tgl lahir developer app nya bego bayangin kl loe lahir th jempol harus scrolling mundur dari ke an butuh waktu berapa lama ;Negatif
412;kok yg terdekat tidak bisa dipilih sih padahal buka loh;Negatif
413;hadeh ada fitur menghidupkan lokasi malah gak sesuai malah ke provinsi sebelah untuk daerah riau gak ada janji jiwa kah perasaan banyak bertebaran di pku tapi malah gak ada beroperasi;Negatif
414;banyak promo gass aplikasi cukup lancar juga;Positif
415;untuk outlet tidak lengkap masa di jogja cuma bisa outlet padahal ada banyak outlet di jogja tolong ini di perbaiki pengen pake promo tapi gini amat;Negatif
416;aplikasi nya kenapa harus sering di update sih jujur lebih suka aplikasi yang dulu harganya lebih murahlebih mudah pake aplikasinya gampang dan gak harus selalu diperbaharui terus setiap beli paket kopi yang promo nya selalu rasanya gak enak entah es nya kebanyakan atau kopinya yang terlalu sedikit kecewa sich sekelas janji jiwa rasa kopinya seperti itu iya mungkin karena promo tapi emang harus semuanya gak enak ;Negatif
417;masih juga belum ada tambahan metode pembayaran cash debit credits card biar lebih beragam jadi kalau customer ga harus top up e wallet ;Negatif
418;aplikasi scam;Negatif
419;sejauh ini bagus tapi dari sisi sinkronisasi antara aplikasi jiwa sama grab kurang banget alhasil sulit berkomunikasi via aplikasi grab pemantauan posis driver juga harus klik lokasi berkali kali untuk sekedar liat posisi driver tolong ditingkatkan yaaa;Netral
420;dah pesan dah bayar tapi tidak jelas statusnya;Negatif
421;baru update kenapa suruh update terus;Negatif
422;apa gunanya aplikasi jjanji jiwa ini mau pesan lewat app x dibatalkan dari pihak janji jiwanya mengecewakan gak lagi beli online maupun offline kacau ;Negatif
423;banyak outlet yg tidak ada di app masa sejogja cuman doang itupun yg tutup mulu;Negatif
424;aplikasi nya setiap di buka update mulu tidak jelas;Negatif
425;menurut saya semua udah bagus tapi agak lambat ketika memberikan respon ketika saya minta pengembalian dana katanya sudah disiaplikasian setelah ditunggu sejam kemudian katanya belum dipick up driver setelah itu ternyata udah di pengembalian dana oleh pihak terkait agak sebel sih;Netral
426;pesan via app selalu gak diterima;Negatif
427;lambat banget tidak niat buat aplikasi ada juga yg ngasih bintang dan seolah menyalahkan device orang wkwkwkw hellow iphone aja pake aplikasi ini juga error' apakah masih bisa pembelaan minimal tuh minta maaf bkan menyalahkan ;Negatif
428;aplikasi apaan gak bisa di pakai jaman sekarang customer lebih mudah dan praktis belanja melalui online kalau tidak segara di perbaiki gak bakal ada kemajuan ;Negatif
429;transaksi gagal uang tidak di kembalikan;Negatif
430;gajelas banget sumpah aplikasi ini;Negatif
431;gw ganti jadi bintang satu gila lama banget loading nya selalu ada notif error tapi pas cek keranjang tiba tiba udh banyak aja yg dipilih karena keterangan selalu error jadi coba klik pesanan berulang kali org juga malas pesan pake aplikasi karena loading nya lama error terus ;Negatif
432;aplikasi lambat buat apa dibikin bukannya mempermudah malah memperlambat tipe developer yang gak mentingin fitur;Negatif
433;error terus app nya;Negatif
434;ui nya ok simple tapiii lambatt bangettt ya tolong perbaiki masa mau pesan aja gabisaaa;Netral
435;aplikasi sampah gabisa atur lokasi sistemnya ngebug trs;Negatif
436;aplikasi terlalu banyak bug;Negatif
437;aplikasi buruk error terus tidak bisa dipakai;Negatif
438;tidak berguna;Negatif
439;ngasih promoan tp pas checkout lama banget loading terus;Negatif
440;aplikasinya lambat;Negatif
441;tidak bisa daftar login;Negatif
442;saya pesan lewat aplikasi ini tiga kali berturut selalu dibatalkan oleh pihak aplikasi tanpa alasan bisa tolong bantu dijawab keluhan saya ini;Negatif
443;banyak promo;Positif
444;pembayaran tidak bisa pakai ovo setelah update versi terbaru sdh lapor disuru di cek berkala sdh seperti ini lebih dari bln mau cek berkala sampai kapan ;Negatif
